#EVENTS;;;;;;;;;;;;;;x
VIETmisc.8154.desc;Today you are in town and paying a visit to someone, and overhear an elderly gentleman saying, “The security in [Root.Capital.GetName] is terrible. Shameful, that’s what it is.” He then continues to criticize your guards and your decisions in regard to protecting the region, without noticing you are right there!;Aujourd'hui, vous êtes en ville et vous rendez visite à quelqu'un. Vous entendez un homme âgé qui dit: "La sécurité dans [Root.Capital.GetName] est terrible. C’est honteux, il y a rien d'autre à dire." Il continue ensuite à critiquer vos gardes et vos décisions en matière de protection de la région, sans se rendre compte que vous êtes là !;;;;;;;;;;x;x
VIETmisc.8154.a;Ignore him.;Ignorez-le.;;;;;;;;;;;;x
VIETmisc.8154.b;Reveal myself and apologize for my errors.;Me révéler et m'excuser pour mes erreurs.;;;;;;;;;;;;x
VIETmisc.8154.c;Reveal myself and discuss what he thinks should be done.;Me révéler et discuter de ce qu'il pense devoir faire.;;;;;;;;;;;;x
VIETmisc.8154.d;Reveal myself and politely tell him to mind his business.;Me révéler et lui dire poliment de s'occuper de ses affaires.;;;;;;;;;;;;x
VIETmisc.8155.desc;You and a few guards are traveling in the more rural parts of the country, when you come across a man sitting by an overturned carriage. He appears to be in pain, and explains he is a traveling merchant. Bandits attacked him and took all his goods. However, he still has some left belongings at his camp nearby. If you escorted him back to his camp, he will compensate you.;Vous et quelques gardes voyagez dans les régions les plus rurales du pays, lorsque vous rencontrez un homme assis près d'une voiture renversée. Il semble avoir mal et explique qu'il est un marchand itinérant. Des bandits l'ont attaqué et ont pris tous ses biens. Cependant, il a encore des objets laissés dans son camp voisin. Si vous le reconduisez dans son camp, il vous indemnisera.;;;;;;;;;;x;x
VIETmisc.8155.a;Sure! Always glad to lend a hand.;Pour sûr ! Toujours heureux de donner un coup de main.;;;;;;;;;;;;x
VIETmisc.8155.b;You’re on your own, stranger.;Vous êtes seul, étranger.;;;;;;;;;;;;x
VIETmisc.8155.c;Something seems fishy. We should leave.;Quelque chose semble louche. Nous devrions partir.;;;;;;;;;;;;x
VIETmisc.8155.d;Something seems fishy. Let’s help, but be on your guard, men.;Quelque chose semble louche. Aidez-nous, mais soyez sur vos gardes, messieurs.;;;;;;;;;;;;x
VIETmisc.8156.tooltip;\n\n\nYou agree to help the merchant.;\n\n\nVous acceptez d'aider le commerçant.;;;;;;;;;;x;x
VIETmisc.8156.desc;The merchant happily leads you back to his camp at a surprisingly brisk pace. Once you approach the camp, however, you realize there are heavily armored men around. The ‘merchant’ shouts to the men, “Looks like we've got ourselves another fool!”;Le marchand vous ramène joyeusement dans son camp à un rythme étonnamment rapide. Cependant, une fois que vous approchez du camp, vous réalisez qu'il y a des hommes bien équipés autour. Le "marchand" crie aux hommes : "On dirait que nous avons nous-mêmes un autre imbécile !";;;;;;;;;;x;x
VIETmisc.8156.a;You and your men fought off the bandits and escaped.;Vous et vos hommes avez combattu les bandits et vous vous êtes échappés.;;;;;;;;;;;;x
VIETmisc.8156.b;You and your men fought the bandits and killed them all.;Vous et vos hommes avez combattu les bandits et les avez tous tués.;;;;;;;;;;;;x
VIETmisc.8156.c;You and your men were alert and prepared, thankfully.;Vous et vos hommes étiez alerte et préparé, heureusement.;;;;;;;;;;;;x
VIET_telrav_fight_a;How could you have been so gullible? That bandit led you into an ambush that almost claimed your life!;Comment avez-vous pu être aussi crédule ? Ce bandit vous a mené dans une embuscade qui vous a presque coûté la vie !;;;;;;;;;;x;x
VIET_telrav_fight_b;Though you were caught off guard, your superior discipline and fighting abilities saved the day, and now the bandits’ ill-gotten gains are all yours.;Bien que vous ayez été pris au dépourvu, votre discipline supérieure et vos capacités de combat vous ont sauvé la vie. Désormais, les gains mal acquis des bandits sont à vous.;;;;;;;;;;x;x
VIET_telrav_fight_c;The bandits stood no chance. What more, their ill-gotten gains are all yours now!;Les bandits n'avaient aucune chance. Quoi de plus, leurs gains mal acquis sont à vous maintenant !;;;;;;;;;;x;x
VIETmisc.8157.desc;The spice merchant says his special blend of spices is like no other - twenty one different spices, to be exact, ground and mixed together. He lets me sample a bit, and I find it pleasurably savory with just a hint of spiciness. He calls it his world famous Twenty One Seasoning Mix, and refuses to sell anyone the recipe.;Le marchand d’épices affirme que son mélange spécial d’épices est unique en son genre : vingt et une épices différentes, pour être exact, moulues et mélangées. Il me laisse un peu goûter, et je trouve ça agréablement savoureux avec juste un soupçon d'épices. Il appelle cela son mélange d'assaisonnement Vingt-Un Assaisonnements, célèbre dans le monde entier, et refuse de vendre la recette à qui que ce soit.;;;;;;;;;;x;x
VIETmisc.8157.a;I will purchase some for my cook to use!;Je vais en acheter pour mon cuisinier !;;;;;;;;;;;;x
VIETmisc.8157.b;I will purchase a lot for my cook to use!;Je vais acheter beaucoup pour mon cuisinier !;;;;;;;;;;;;x
VIETmisc.8157.c;It's nice, but not good enough for me.;C'est gentil, mais pas assez bon pour moi.;;;;;;;;;;;;x
VIETmisc.8158.desc;I am eating pasta, and I realize it tastes rather bland. But what if… I added something to spice it up?\n\nAfter thinking it over, I decide to grace my pasta with a large helping of:;Je mange des pâtes, et je me rends compte que leur goût est plutôt fade. Mais que se passe-t-il si… j’ajoute quelque chose pour les pimenter ? \n\nAprès y avoir réfléchi, je décide de garnir mes pâtes d’une grande portion de :;;;;;;;;;;x;x
VIETmisc.8158.a;Basil;Basilic;;;;;;;;;;;;x
VIETmisc.8158.b;Oregano;Origan;;;;;;;;;;;;x
VIETmisc.8158.c;Crumbly cheese;Fromage friable;;;;;;;;;;;;x
VIETmisc.8158.d;Salt;Sel;;;;;;;;;;;;x
VIETmisc.8159.desc;The holy men say I should cut down on the garlic and onion in my diet. Though many learned men say these plants do have their medical benefits, traditionally [Root.Religion.GetName] belief argues that consuming these pungent plants is spiritually dangerous, as they stimulate sexual and aggressive desires in the body.;Les hommes saints disent que je devrais réduire la part d'ail et d'oignon dans mon alimentation. Bien que de nombreux érudits disent que ces plantes ont leurs avantages médicaux, la croyance traditionnelle [Root.Religion.GetName] soutient que la consommation de ces plantes piquantes est spirituellement dangereuse, car elles stimulent les désirs sexuels et agressifs dans le corps.;;;;;;;;;;x;x
VIETmisc.8159.a;Give up delicious food? No way!;Renoncer à la nourriture délicieuse ? En aucune façon !;;;;;;;;;;;;x
VIETmisc.8159.b;I can eat less, sure.;Je peux en manger moins, bien sûr.;;;;;;;;;;;;x
VIETmisc.8159.c;But what if I want to stimulate myself?;Mais que faire si je veux me stimuler ?;;;;;;;;;;;;x
VIETmisc.8159.d;What a silly fear of mere plants!;Quelle peur idiote, ce ne sont que de simples plantes !;;;;;;;;;;;;x
VIETmisc.8160.desc;[target_VIET_muslim_garlic_courtier.GetTitledName] ate something with a lot of garlic in it before coming to the mosque, and everyone can spell it on [target_VIET_muslim_garlic_courtier.GetHerHis] breath. To quote hadith, the Prophet (Peace Be Upon Him) said: “He who eats garlic should not come near this mosque until its odour goes away.”;[target_VIET_muslim_garlic_courtier.GetTitledName] a mangé quelque chose avec beaucoup d'ail avant de venir à la mosquée, et tout le monde peut sentir son souffle. Pour citer un hadith, le prophète (Que la paix soit sur lui) a déclaré : "Celui qui mange de l’ail ne doit pas s’approcher de cette mosquée avant que son odeur ne disparaisse.";;;;;;;;;;x;x
VIETmisc.8160.a;Not my place to worry.;Ce n'est pas à moi de m'inquiéter.;;;;;;;;;;;;x
VIETmisc.8160.b;Privately tell [target_VIET_muslim_garlic_courtier.GetFirstName] this is not acceptable.;Dites en privé à [target_VIET_muslim_garlic_courtier.GetFirstName] que ce n'est pas acceptable.;;;;;;;;;;;;x
VIETmisc.8160.c;Privately tell [target_VIET_muslim_garlic_courtier.GetFirstName] to leave immediately.;Indiquez en privé à [target_VIET_muslim_garlic_courtier.GetFirstName] de partir immédiatement.;;;;;;;;;;;;x
VIETmisc.8160.d;Publicly shame and kick [target_VIET_muslim_garlic_courtier.GetHerHim] out.;Manifester publiquement votre honte et virez-le.;;;;;;;;;;;;x
VIETmisc.8161.desc;My cook asks what sort of onion I want most of in my meal today.;Mon cuisinier me demande quel genre d'oignon je veux le plus dans mon repas aujourd'hui.;;;;;;;;;;x;x
VIETmisc.8161.a;Red onion;Oignon rouge;;;;;;;;;;;;x
VIETmisc.8161.b;White onion;Oignon blanc;;;;;;;;;;;;x
VIETmisc.8161.c;Green onion;Oignon vert;;;;;;;;;;;;x
VIETmisc.8161.d;Why can't you decide? You’re the culinary expert!;Pourquoi il ne peut pas décider lui-même ?;;;;;;;;;;;;x
VIETmisc.8162.desc;Cinnamon is delicious, but few in Europe know where the exotic spice comes from. Your courtiers are debating various theories about cinnamon's origin that they know of. You relay one theory you heard a while back, and find to be plausible:;La cannelle est délicieuse, mais rares sont les Européens qui savent d'où provient l'épice exotique. Vos courtisans débattent de diverses théories sur l’origine de la cannelle qu’ils connaissent. Vous relevez une théorie que vous avez entendue il y a quelque temps et que vous trouvez plausible :;;;;;;;;;;x;x
VIETmisc.8162.a;Giant Arabian birds collect it from a mysterious land to use for nests;Des oiseaux arabes géants le récupèrent d'un pays mystérieux pour l'utiliser comme nid;;;;;;;;;;;;x
VIETmisc.8162.b;Fishers cast nets over the edge of the world;Les pêcheurs jettent des filets au bout du monde;;;;;;;;;;;;x
VIETmisc.8162.c;Eastern sorcerers grow it with their magics;Les sorciers orientaux le cultivent avec leurs magies;;;;;;;;;;;;x
VIETmisc.8162.d;It's probably just another plant they farm somewhere;C'est probablement juste une autre plante qu'ils cultivent quelque part;;;;;;;;;;;;x
VIET_cinnamon_question_a;The crafty Saracens trick the birds into fleeing, and then take the sticks;Les sarrasins rusés incitent les oiseaux à fuir, puis prennent les bâtons;;;;;;;;;;x;x
VIET_cinnamon_question_b;These fishermen do this over the source of the Nile;Ces pêcheurs font cela sur la source du Nil;;;;;;;;;;x;x
VIET_cinnamon_question_c;The sorcerers know ancient incantations that transform ordinary plants into the spice;Les sorciers connaissent d'anciennes incantations qui transforment des plantes ordinaires en épice.;;;;;;;;;;x;x
VIET_cinnamon_question_d;Perhaps it is harvested from the fabled Spice Islands;Peut-être qu'il est récolté sur de légendaires îles aux épices;;;;;;;;;;x;x
VIETmisc.8163.desc;The visiting merchants present you with a gift of Dhana Jiru - an Indian spice mix made using mainly roasted ground cumin and coriander, mixed with various other spices - for your cooks’ use.;Les marchands en visite vous présentent un cadeau de Dhana Jiru - un mélange d’épices indiennes composées principalement de cumin moulu torréfié et de coriandre, mélangé à diverses autres épices - à l’usage de vos cuisiniers.;;;;;;;;;;x;x
VIETmisc.8163.a;Delicious!;Délicieux !;;;;;;;;;;;;x
VIETmisc.8163.b;Sounds too spicy for me.;Cela semble trop épicé pour moi.;;;;;;;;;;;;x
VIETmisc.8164.desc;Someone is offering you jira water - a popular drink from southern India made with boiled cumin seeds, drunk and enjoyed by all, from the lowest of beggars to the highest of rajas.;Quelqu'un vous offre de l’eau jira - une boisson populaire du sud de l’Inde à base de graines de cumin bouillies, bue et appréciée de tous, du plus bas des mendiants au plus élevé des rajas.;;;;;;;;;;x;x
VIETmisc.8164.a;Thank you!;Je vous remercie !;;;;;;;;;;;;x
VIETmisc.8165.desc;Some are aware of my melancholy moods, and have recommended I bath in some saffron to heal myself. It has been used for this purpose in Iran since the days of the ancient Persian kings but I am unsure whether I should do this. On the other hand, saffron is very expensive.;Certains sont conscients de mon humeur mélancolique et m'ont recommandé de prendre un bain de safran pour me soigner. Il a été utilisé à cette fin en Iran depuis l’époque des anciens rois perses, mais je ne suis pas sûr de vouloir le faire. En effet, le safran coûte très cher.;;;;;;;;;;x;x
VIETmisc.8165.a;It better be worth it!;Ça doit en valoir la peine !;;;;;;;;;;;;x
VIETmisc.8165.b;It costs too much.;Ça coûte trop cher.;;;;;;;;;;;;x
VIETmisc.8165.c;I don't think it works!;Je ne pense pas que ça marche !;;;;;;;;;;;;x
VIETmisc.8166.desc;Since ancient days, saffron hasn't been used only for food, perfume, or as medicine - it has also been used as an aphrodisiac! A merchant I trust is offering me a special kind of saffron for a relatively cheap price. I am to put it in my bath waters as Cleopatra herself once did, according to legend, and bathe together with a lover, to make our lovemaking even more pleasurable.;Depuis l'Antiquité, le safran n'a pas été utilisé uniquement pour l'alimentation, le parfum ou la médecine - il a également été utilisé comme aphrodisiaque ! Un marchand, je l’espère, m’offre un type particulier de safran pour un prix relativement bon marché. Je dois le mettre dans les eaux de mon bain comme Cléopâtre l’a fait elle-même une fois, selon la légende, et se baigner avec un amant pour rendre notre amour encore plus agréable.;;;;;;;;;;x;x
VIETmisc.8166.a;Buy some for me and my spouse.;Achetez-en pour moi et mon épouse.;;;;;;;;;;;;x
VIETmisc.8166.b;I'll like some for me and my lover.;Je vais en aimer pour moi et ma maîtresse.;;;;;;;;;;;;x
VIETmisc.8166.c;I’ll find a courtesan to share this with.;Je vais trouver une courtisane avec qui partager cela.;;;;;;;;;;;;x
VIETmisc.8166.d;I’ll find a handsome page to share this with.;Je vais trouver une belle page avec laquelle partager cela.;;;;;;;;;;;;x
VIETmisc.8166.e;On second thought, I don't need it.;À la réflexion, je n'en ai pas besoin.;;;;;;;;;;;;x
VIETmisc.8167.desc;You were gifted some asafoetida spice the other day but didn't find much use for it as it is rarely used outside of India for culinary purposes. However, several people you know currently have situations where this herb may be of great use as it has many non-culinary properties, but you only have enough to give to one person.;L’autre jour, vous avez reçu une épice d’asafoetida, mais vous n’avez pas trouvé grand intérêt à l’utiliser car elle est rarement utilisée en dehors de l’Inde à des fins culinaires. Cependant, plusieurs personnes que vous connaissez connaissent actuellement des situations où cette plante peut être très utile, car elle possède de nombreuses propriétés non culinaires, mais vous en avez de quoi en donner qu'à une seule personne.;;;;;;;;;;x;x
VIETmisc.8167.a;Help the awkward maidservant with her constant flatulence;Aider la servante maladroite avec sa flatulence constante;;;;;;;;;;;;x
VIETmisc.8167.b;Help the lusty merchant use it as an aphrodisiac;Aider le commerçant vigoureux à l'utiliser comme aphrodisiaque;;;;;;;;;;;;x
VIETmisc.8167.c;Help the scribe kill a tree at his home to clear way for renovations;Aider le scribe à abattre un arbre chez lui pour dégager le chemin de la rénovation;;;;;;;;;;;;x
VIETmisc.8167.d;Help the elderly midwife with her breathing problems;Aider la sage-femme âgée à résoudre ses problèmes respiratoires;;;;;;;;;;;;x
VIETmisc.8168.desc.a;You've noticed lately that at the edge of your residence, a large clump of wood evans is growing on the ground. They say this herb wards off evil spirits and repels venomous snakes, so this is an encouraging and auspicious sign, surely! For us Christians particularly, because its leaves grow in threes, it also reminds us of the Holy Trinity.;Vous avez remarqué dernièrement qu’à la limite de votre résidence, un gros bouquet d’évans de bois se développe sur le sol. Les gens disent que cette herbe éloigne les mauvais esprits et repousse les serpents venimeux, c'est donc un signe encourageant et propice, à coup sûr ! Pour nous, chrétiens en particulier, parce que ses feuilles poussent par trois, cela nous rappelle également la Sainte Trinité.;;;;;;;;;;x;x
VIETmisc.8168.desc.b;You've noticed lately that at the edge of your residence, a large clump of wood evans is growing on the ground. They say this herb wards off evil spirits and repels venomous snakes, so this is an encouraging and auspicious sign, surely!;Vous avez remarqué dernièrement qu’à la limite de votre résidence, un gros bouquet d’évans de bois se développe sur le sol. Les gens disent que cette herbe éloigne les mauvais esprits et repousse les serpents venimeux, c'est donc un signe encourageant et propice, à coup sûr !;;;;;;;;;;x;x
VIETmisc.8168.a;Very well! A good sign.;Très bien ! Bon signe;;;;;;;;;;;;x
VIETmisc.8168.b;Protect that area and have my servants care for it.;Protéger cette zone et demander à mes serviteurs de s'en occuper.;;;;;;;;;;;;x
VIETmisc.8168.c;Wait a moment - we should clear these useless weeds!;Attendez un instant - nous devrions éliminer ces mauvaises herbes inutiles !;;;;;;;;;;;;x
VIETmisc.8169.desc;The Alkanet herb, when mixed with oil, produces a crimson red color that looks like blood. One of the adults has a lot of alkanet lying around. One day, I’m bored, and wonder if I can use it to prank someone.;La plante Alkanet, lorsqu'elle est mélangée à de l'huile, produit une couleur rouge cramoisi qui ressemble à du sang. Un des adultes a beaucoup d'alcanet qui traîne. Un jour, je m'ennuie et je me demande si je peux l’utiliser pour blaguer quelqu'un.;;;;;;;;;;x;x
VIETmisc.8169.a;I'll find another kid and pretend I'm bleeding;Je vais trouver un autre enfant et prétendre que je saigne;;;;;;;;;;;;x
VIETmisc.8169.b;I'll find a servant and pretend I'm bleeding;Je vais trouver un serviteur et prétendre que je saigne;;;;;;;;;;;;x
VIETmisc.8169.c;I shouldn't worry people like this;Je ne devrais pas inquiéter les gens comme ça;;;;;;;;;;;;x
VIETmisc.8169.d;I want to study and learn more about it instead;Je veux étudier et en apprendre davantage à la place;;;;;;;;;;;;x
VIETmisc.8170.desc;Traders from afar have brought a shipment of cardamom and are offering to sell it to me for a good price. Though the spice isn’t native to Scandinavia, it is becoming increasingly popular in [Root.Culture.GetName] cuisine.;Les commerçants de grands chemins ont apporté une cargaison de cardamome et me proposent de la vendre à un bon prix. Bien que l’épice ne soit pas originaire de Scandinavie, elle est de plus en plus populaire dans la cuisine [Root.Culture.GetName].;;;;;;;;;;x;x
VIETmisc.8170.a;I’d love my cook to use it when cooking dessert.;J'adorerais que mon cuisinier l'utilise lors de la préparation d'un dessert.;;;;;;;;;;;;x
VIETmisc.8170.b;I’ll pass.;Je m'en passerai.;;;;;;;;;;;;x
VIETmisc.8171.desc;I am drinking a sweet drink made from the syrup of the carob plant.;Je bois une boisson sucrée à base de sirop de caroube.;;;;;;;;;;x;x
VIETmisc.8171.a;Refreshingly sweet!;C'est rafraîchissant !;;;;;;;;;;;;x
VIETmisc.8172.desc;After I had a meal with my court, [target_VIET_caraway_courtier.GetTitledName] offers me some caraway [target_VIET_caraway_courtier.GetSheHe] recently bought. Chewing on caraway seeds would help freshen our breath after dinner.;Après avoir mangé avec ma cour, [target_VIET_caraway_courtier.GetTitledName] m'offre du carvi qu'[target_VIET_caraway_courtier.GetSheHe] a récemment acheté. Mâcher des graines de cumin aiderait à rafraîchir l'haleine après le dîner.;;;;;;;;;;x;x
VIETmisc.8172.a;Thanks. That is very considerate of you.;Merci. C'est très attentionné de votre part.;;;;;;;;;;;;x
VIETmisc.8172.b;No thank you, but I appreciate it.;Non merci, mais j'apprécie.;;;;;;;;;;;;x
VIETmisc.8172.c;Are you trying to poison me?;Est-ce que vous essayez de m'empoisonner ?;;;;;;;;;;;;x
VIETmisc.8173.desc;I'm hungry, but don't want to eat much, so I decide to snack on some quark cheese flavored with chopped chives.;J'ai faim, mais je ne veux pas manger beaucoup, alors je décide de grignoter du fromage blanc parfumé à la ciboulette ciselée.;;;;;;;;;;x;x
VIETmisc.8173.a;Give me a lot to eat!;Donnez-moi en beaucoup à manger !;;;;;;;;;;;;x
VIETmisc.8173.b;I'll eat a bit and wash it down with water.;Je vais manger un peu et me laver avec de l'eau.;;;;;;;;;;;;x
VIETmisc.8174.desc;You visit someone living nearby and notice there are a lot of chives hanging from their walls, ceilings, doorways, and more. Your host says it's to ward off evil and disease.;Vous rendez visite à une personne habitant à proximité et remarquez que de la ciboulette est accrochée aux murs, aux plafonds, aux portes et plus encore. Votre hôte dit que c'est pour conjurer le mal et la maladie.;;;;;;;;;;x;x
VIETmisc.8174.a;Maybe I should try this!;Peut-être que je devrais essayer ça !;;;;;;;;;;;;x
VIETmisc.8174.b;Bunch of superstition.;Bouquet de superstition.;;;;;;;;;;;;x
VIETmisc.8175.desc;Your servant asks if you would like more chopped cilantro on your stew and salad.;Votre serviteur vous demande si vous souhaitez plus de coriandre hachée sur votre ragoût et votre salade.;;;;;;;;;;x;x
VIETmisc.8175.a;No thanks.;Non merci.;;;;;;;;;;;;x
VIETmisc.8175.b;Just a bit.;Juste un peu.;;;;;;;;;;;;x
VIETmisc.8175.c;A lot! A lot!;Beaucoup ! Beaucoup !;;;;;;;;;;;;x
VIETmisc.8176.desc;The food I'm eating for today tastes a little bland, and want to add some spice to add a bit of a kick to the taste. I look around and see what spices are on the table, and settle on using cumin, the classic ancient spice of [Root.Culture.GetName] cuisine. I sprinkle some on my meal.;La nourriture que je mange aujourd'hui a un goût un peu fade et je veux ajouter des épices pour donner un coup de fouet au goût. Je regarde autour de moi et vois quelles épices sont sur la table, et je me sers du cumin, l'épice ancienne classique de la cuisine [Root.Culture.GetName]. J'en saupoudre sur mon repas.;;;;;;;;;;x;x
VIETmisc.8176.a;Now it is much better!;Maintenant c'est beaucoup mieux !;;;;;;;;;;;;x
VIETmisc.8177.desc;I was feeling a bit of a headache today so the physician recommended some clove oil to reduce the pain.;J'avais un peu mal à la tête aujourd'hui, alors le médecin a recommandé de l'huile de girofle pour réduire la douleur.;;;;;;;;;;x;x
VIETmisc.8177.a;Will do.;Ça ira.;;;;;;;;;;;;x
VIETmisc.8177.b;I don’t feel like buying it.;Je n'ai pas envie de l'acheter.;;;;;;;;;;;;x
VIETmisc.8178.desc;A local farmer accidentally made too much Leyden cheese and doesn't know what to do with it. He offers the cheese to you as a gift. This special cheese, flavored with cumin and caraway seeds, is a sure culinary delight, but even you realize it is a lot of cheese to take at once.;Un agriculteur local a accidentellement fabriqué trop de fromage Leyden et ne sait pas quoi en faire. Il vous offre le fromage en cadeau. Ce fromage spécial, aromatisé au cumin et aux graines de cumin, est un délice culinaire, mais même vous vous rendez compte qu’il faut prendre beaucoup de fromage à la fois.;;;;;;;;;;x;x
VIETmisc.8178.a;Well, we'll try to eat as much as we can.;Eh bien, nous allons essayer de manger autant que possible.;;;;;;;;;;;;x
VIETmisc.8178.b;I must pay the farmer for such generosity.;Je dois payer le fermier pour une telle générosité.;;;;;;;;;;;;x
VIETmisc.8178.c;Buy it and donate it to help feed the poor.;Achetez-le et donnez-le pour nourrir les pauvres.;;;;;;;;;;;;x
VIETmisc.8178.d;I don't like this kind of cheese!;Je n'aime pas ce genre de fromage !;;;;;;;;;;;;x
VIETmisc.8179.desc;Oof! That was quite a meal I had! All that delicious curry and naan and meat and more, and now I'm feeling stuffed and my mouth odor is pungent. The servants bring out some roasted fennel seeds for me to chew on to reduce my bloatedness and my bad breath.;Oof ! C'était tout un repas que j'ai eu ! Tout ce délicieux curry, naan, viande et plus encore, et maintenant je me sens bourré et mon odeur en bouche est âcre. Les domestiques apportent des graines de fenouil grillées que je mâche afin de réduire mon gonflement et ma mauvaise haleine.;;;;;;;;;;x;x
VIETmisc.8179.a;Much better.;Beaucoup mieux.;;;;;;;;;;;;x
VIETmisc.8180.desc;My workload has been very heavy as of late, and my stomach hurts and my body feels fatigued. My physician recommends me drink some tea made from ginger for a while.;Ma charge de travail a été très lourde ces derniers temps, mon estomac me fait mal et mon corps est fatigué. Mon médecin me recommande de boire du thé à base de gingembre pendant un moment.;;;;;;;;;;x;x
VIETmisc.8180.a;Good idea. Plus it tastes good!;Bonne idée. En plus c'est bon !;;;;;;;;;;;;x
VIETmisc.8180.b;I don't like ginger but I'll sweeten it with honey.;Je n'aime pas le gingembre mais je vais l'adoucir avec du miel.;;;;;;;;;;;;x
VIETmisc.8180.c;I don't like ginger and won't drink it.;Je n'aime pas le gingembre et ne le bois pas.;;;;;;;;;;;;x
